{
  "$schema": "http://json-schema.org/draft-04/schema#",
  "type": "object",
  "properties": {
    "Results": {
      "type": "array",
      "items": {
        "$ref": "map-variant.schema.json"
      }
    },
    "Start": {
      "type": "integer"
    },
    "Count": {
      "type": "integer"
    },
    "ResultCount": {
      "type": "integer"
    },
    "TotalCount": {
      "type": "integer"
    },
    "Links": {
      "type": "object",
      "properties": {}
    }
  },
  "required": [
    "Results",
    "Start",
    "Count",
    "ResultCount",
    "TotalCount",
    "Links"
  ]
}